{
  "schema_version": 1,
  "attempt_id": "success",
  "run_id": "20261009-1100-variant",
  "target_id": "synthetic-local",
  "target_profile_sha256": "0000000000000000000000000000000000000000000000000000000000000000",
  "status": "succeeded",
  "started_at": "2026-10-09T11:03:00Z",
  "finished_at": "2026-10-09T11:04:00Z",
  "exit_code": 0,
  "actual": {
    "working_directory": ".",
    "output_location": "experiments/20261009-1100-variant/artifacts/result.md",
    "log_location": null,
    "hostname": null,
    "os": null,
    "gpu": null,
    "driver": null,
    "cuda": null,
    "python": null,
    "commit": null,
    "recipe_hash": null
  },
  "output_inventory": null
}
